{
  "artifact_type": "hyperray_model",
  "schema_version": 1,
  "artifact_id": "model.explicit.fixture",
  "model_id": "model.explicit",
  "boundary_artifact": { "artifact_id": "boundary", "sha256": "0000000000000000000000000000000000000000000000000000000000000000" },
  "executable_image": { "artifact_id": "image", "sha256": "0000000000000000000000000000000000000000000000000000000000000000" },
  "semantics": {
    "target_instruction": { "artifact_id": "semantics.target", "sha256": "0000000000000000000000000000000000000000000000000000000000000000" },
    "memory_model": { "artifact_id": "semantics.memory", "sha256": "0000000000000000000000000000000000000000000000000000000000000000" },
    "runtime": { "artifact_id": "semantics.runtime", "sha256": "0000000000000000000000000000000000000000000000000000000000000000" },
    "scheduler": { "artifact_id": "semantics.scheduler", "sha256": "0000000000000000000000000000000000000000000000000000000000000000" },
    "environment": { "artifact_id": "semantics.environment", "sha256": "0000000000000000000000000000000000000000000000000000000000000000" }
  },
  "requirement_artifacts": [
    { "artifact_id": "requirement", "sha256": "0000000000000000000000000000000000000000000000000000000000000000" }
  ],
  "encoding": {
    "kind": "explicit_graph",
    "encoding_version": 1,
    "exact_state_count": 1,
    "exact_transition_count": 0,
    "state_components": [
      { "component_id": "pc", "component_class": "machine_control", "finite_domain_id": "pc.domain", "cardinality": 1 },
      { "component_id": "memory", "component_class": "memory", "finite_domain_id": "memory.domain", "cardinality": 1 },
      { "component_id": "runtime", "component_class": "runtime", "finite_domain_id": "runtime.domain", "cardinality": 1 },
      { "component_id": "scheduler", "component_class": "scheduler", "finite_domain_id": "scheduler.domain", "cardinality": 1 },
      { "component_id": "environment", "component_class": "environment", "finite_domain_id": "environment.domain", "cardinality": 1 },
      { "component_id": "monitor", "component_class": "requirement_monitor", "finite_domain_id": "monitor.domain", "cardinality": 1 }
    ],
    "states": [
      {
        "state_id": "s0",
        "component_values": [{ "component_id": "pc", "value": 0 }],
        "canonical_state_sha256": "0000000000000000000000000000000000000000000000000000000000000000"
      }
    ],
    "transitions": [],
    "labels": [
      {
        "state_id": "s0",
        "classification": { "kind": "nonterminal" },
        "requirement_label_ids": [],
        "acceptance_ids": [],
        "error_ids": []
      }
    ],
    "roots": [{ "kind": "explicit_state_set", "root_id": "root.main", "state_ids": ["s0"] }],
    "exact_state_equality": { "artifact_id": "proof.state-equality", "sha256": "0000000000000000000000000000000000000000000000000000000000000000" }
  }
}
